{
  "schemaVersion": "1.0.0",
  "bundleId": "20000000-0000-4000-8000-000000000001",
  "incidentId": "20000000-0000-4000-8000-000000000002",
  "runId": "20000000-0000-4000-8000-000000000003",
  "stepId": "20000000-0000-4000-8000-000000000004",
  "generatedAt": "2026-07-15T01:10:06Z",
  "observationBatchIds": [
    "10000000-0000-4000-8000-000000000001"
  ],
  "codeFindingArtifactIds": [
    "30000000-0000-4000-8000-000000000004"
  ],
  "knowledgeResultArtifactIds": [],
  "evidence": [
    {
      "evidenceId": "20000000-0000-4000-8000-000000000004",
      "evidenceCode": "metric.inventory.dependency_latency_high",
      "factOrigin": "RUNTIME",
      "signalType": "METRIC",
      "resource": {
        "resourceId": "service:inventory-service",
        "resourceType": "SERVICE",
        "systemId": "sample-commerce",
        "serviceName": "inventory-service"
      },
      "claim": "inventory-service dependency latency p95 exceeded the scenario baseline during the incident window",
      "timeWindow": {
        "start": "2026-07-15T01:00:00Z",
        "end": "2026-07-15T01:10:00Z"
      },
      "artifactIds": [
        "10000000-0000-4000-8000-000000000003"
      ],
      "provenanceRefs": [
        {
          "kind": "RUNTIME_OBSERVATION",
          "batchId": "10000000-0000-4000-8000-000000000001",
          "observationId": "10000000-0000-4000-8000-000000000002",
          "sourceId": "test-prometheus-primary"
        }
      ]
    },
    {
      "evidenceId": "20000000-0000-4000-8000-000000000005",
      "evidenceCode": "code.order.inventory_timeout_without_retry",
      "factOrigin": "CODE",
      "signalType": "CODE",
      "resource": {
        "resourceId": "symbol:InventoryClient.reserve",
        "resourceType": "SYMBOL",
        "systemId": "sample-commerce",
        "serviceName": "order-service"
      },
      "claim": "InventoryClient.reserve configures a 3000 ms timeout and no retry policy in repository revision 8f2a947000000000000000000000000000000000.",
      "timeWindow": null,
      "artifactIds": [
        "30000000-0000-4000-8000-000000000003"
      ],
      "provenanceRefs": [
        {
          "kind": "CODE_FINDING",
          "findingArtifactId": "30000000-0000-4000-8000-000000000004",
          "findingSetId": "30000000-0000-4000-8000-000000000001",
          "findingId": "30000000-0000-4000-8000-000000000002",
          "repositoryId": "sample-commerce",
          "revision": "8f2a947000000000000000000000000000000000"
        }
      ]
    }
  ],
  "missingEvidence": []
}
